"","article_URL","creator","article_title","content","date","img_link"
"25","https://www.match-maker.ventures/interview-with-chris-morgan/","MatchMakerVentures","New era of digital media: Programmatic & Corp-Up. Interview with Chris Morgan","Digital is here. But what’s next? Originally from England, Chris Morgan dived into the media industry straight out of Oxford’s PPE* degree. Having started his career at BBC Magazines division, he progressed to Publicitas to launch his career in international media. Currently, he is at the forefront of the digital world with a cutting-edge tech startup Sentifi. With decades of media experience and as a witness to the first phase of the digital media era, our Match-Maker and media industry expert sat down with us to share his insights. *Philosophy, Politics and Economics You recently rediscovered yourself in the startup landscape. What was your career journey? I was in at the start of the digital era, or Digital 1.0, which was quite a difficult time to be in media because of the crash that happened around 2000. It was a difficult time for media companies trying to understand what the dynamics of the digital media landscape would be, and then they had this terrible experience with the first crash. My career became 100% digitally focused after 2007, so I lived through that print to digital transformation and helped Publicitas to go through that transformation process. I’ve had a corporate background up until this year, and after Publicitas shut down in most European markets, including Switzerland where I have been based since 2010, that was my springboard to get serious about the startup world. Working with Match-Maker Ventures since May and joining Sentifi – a media and finance tech startup – in October became my launch pad into the startup world. How has the media industry transformed? When I started my career, print was still a dominant sector of the overall media spending in the media landscape. The key change I’ve seen in the digital landscape has been ‘programmatic’. I first started reading and learning about ad networks and ad exchanges around 2010. Programmatic is more than mainstream now, accounting for up to 80% of ad spend in selected countries in Europe. It was incredible to witness the start of programmatic industry. To me it’s the most dramatic driver of change in the business, hand in hand with the emphasis on buying audience and using data to drive marketing decisions. The industry moved from focusing on context and media environment as a proxy for audience, to a conversation only about audience – meaning data-driven marketing and using data to buy audiences. Now we are coming full circle, understanding that both data-driven media buying and premium contextual environment are extremely important for ensuring brand safety. We realised the need to better understand the context of where the message is delivered and to whom it’s delivered. How is the startup scene within the digital marketing industry? I think it’s extremely dynamic. Not to discourage anyone from getting involved in startups, but it’s also extremely difficult to be successful. I’ve seen how hard it is to make a living out of it and differentiate oneself. The startup scene is full of driven, intelligent and fun people but it’s very challenging to find that positioning in the marketplace where you can shine without a hundred other people doing the same thing as you are. The startup village at DMEXCO was my recent experience of digital startups and a great signal that there are still a lot of interesting new players coming into this competitive landscape. In other words, the potential is huge yet being successful in this industry is very hard? You either have to have something very distinctive about your business model, or something special about your particular asset… Or maybe there’s a barrier to entry for other players? So it’s very difficult to make that space for yourself when there are many other startups doing something similar or pushing the same agenda as you’re pushing. It’s very dynamic and there’s a lot at stake – the digital advertising market is so big and there’s a lot to play for. But differentiating yourself is very hard because everyone wants a piece of the pie. That’s why you need the support of organisations like Match-Maker Ventures to help startups reach out to corporate partners and customers. What was your key takeaway from DMEXCO? What an enormous player Amazon advertising quickly became. I can see companies growing up around the Amazon advertising platform, facilitating access to it and helping businesses to take advantage of the power of Amazon’s advertising offer. It will hopefully spawn a very strong startup scene around it when it becomes more mature and when SMEs start to take notice of it. What developments do you foresee in the startup scene? It very difficult to predict what will come through in the next 5-10 years. My gut feeling is that we will be talking about ‘programmatic everything’, and will be calling it ‘digital marketing’ with the assumption that it is driven by automated systems in the background. I was recently reading an article that said that the next step for digital is not about IoT (Internet of Things) and voice, it’s actually about audio – programmatic radio and audio advertising. A few weeks ago, at the Programmatic Advertising Day in Switzerland, I heard an interesting presentation from Splicky, which is a DSP capable of managing programmatic out-of-home media buying. What about FAANG*’s market domination? There is no reason to think that Facebook, Google, Amazon and Netflix won’t be huge dominant forces also in the future. Probably the dynamics and legislative landscape around these companies will change because of the recent controversies that we’ve seen which caused reputation damage at least… These companies became huge so fast, they are bound to have issues, such as how they manage personal data. It doesn’t mean that it will existentially threaten these giant American players, but we’ll have to keep a careful eye on how those big platforms develop and how consumers use them in the future. *Facebook, Amazon, Apple, Netflix, Google Your professional path led you to Sentifi. What is special about this startup? Sentifi is a very interesting company in my mind – I see it somehow as a synthesis of some of these trends that we’ve talked about. Sentifi uses cutting-edge machine learning capabilities to solve the problem of how to make sense of enormous quantities of data generated around the subject of financial services and financial assets. That’s a great example of how cutting-edge technologies can transform both our business and personal lives and help make sense of that crowded data landscape. What Sentifi does, it taps into the context trend: it makes sense of data and resurfaces that data in a premium environment and a premium context. It also helps you contextualise that data around the subjects that are happening in the world. It’s about premium media, finding the right audience, driving utility to users, helping investors and financial decision-makers to make sense of that cloud of data that surrounds these topics. How do you see your Match-Maker role at Match-Maker Ventures? I think the Match-Maker model is very interesting. I like the Corp-Up model. As someone in my previous role who tried to drive innovation from within the corporate, I’ve seen how difficult it is. To my mind, the Match-Maker model can be very helpful to those companies that are struggling with innovation. This idea of bringing together the best of the startup world with corporates who are looking to innovate but don’t necessarily have the internal capabilities to do so – I’ve lived it from the other side and have seen how useful it could’ve been to have a company like Match-Maker Ventures in the mix to drive corporate innovation. For some of these companies in the media branch, it’s ‘innovate or die’ – which is why Match-Maker Ventures can be such a powerful partner for them.","3. December 2018.","https://www.match-maker.ventures/wp-content/uploads/2018/12/acoustic-amplifier-artist-114820-300x200.jpg"
"26","https://www.match-maker.ventures/interview-with-erik-pfannmoller/","MatchMakerVentures","Customer service & chatbots: Interview with Erik Pfannmöller, Solvemate","We invited Erik Pfannmöller, CEO / Founder of Solvemate as a guest speaker to give his view on the importance of customer experience and chatbots in customer service improvement. Solvemate provides a cutting-edge and proven platform to automate customer support based on deep-learning and chatbot technology. How did you come up with the chatbot startup idea? Prior to founding Solvemate I was leading an e-commerce company as founder and CEO. We had 15 customer service agents dealing with 250.000 service requests per year and I noticed three problems: 1) customer satisfaction dropped dramatically as waiting times increased, 2) turn-over in the customer support team was higher than any other department, due to the repetitiveness of their work, and 3) it was too expensive to do anything about it. I am a big math nerd and have always found machine learning exciting. Now I saw a real case for building a company to solve a massive problem. What main challenges do organisations face in customer support nowadays? In addition to the above mentioned steady pressure to bring down costs for customer support while maintaining a high quality, big corporates face the digitalization issue. In big call centers we have seen technology that is 5-10 years old which just is not (yet) compatible with lightweight Software-as-a-Service solutions like Solvemate. There is technical debt existing, that needs to be tackled. Today, in the customer service industry, we are in the era of solutions based on chatbots, deep learning and AI, will this continue or what’s next? Yes, this development will continue. Our whole society is moving towards an “instant economy”, which means that we want all product and services available whenever, wherever and in real-time. This trend will continue and chatbots will be a solution to make customer support instant and affordable. What are the reasons any organisation should invest in their customer service approach and infrastructure? And any do’s and don’ts you would like to recommend? Invest: Increased satisfaction leads to more loyal customers that buy more. Transform your service agents into consultants and give their work renewed meaning. Do’s / don’ts: DO think about the customer and what they want to achieve – finding a solution to their problem as soon as possible. DO NOT force customers down one path. People have different preferences and some people will still choose to wait 10min for someone to pick up the phone over solving the problem in 12seconds with a chatbot. Customers will learn and preferences will change. Looking at your experience in building startups, which main barriers do you recon still exist between startups and corporations? Moving fast in startups vs slow decision making in corporates. In addition to that, we sometimes see that corporates expect significant results without the clear willingness to invest into Proof of Concepts. Can you share specific success stories from your partnerships with corporations? On www.solvemate.com/customers you can find a selection of customer success stories. One we did with one of the leading German Banks – Sparkasse. Find it at www.solvemate.com/sparkasse. You have recently entered a strategic partnership with MMV. What were the reasons and what do you expect as a result from that? MMV brings with it a unique network of well seasoned industry professionals, with deep network into our target markets. This type of people are not possible for a startup to hire, so partnering with MMV will enable us to open more doors in a shorter amount of time, than we would on our own. To be up-to-date with the latest chatbot trends, check Erik’s blog out!","4. July 2018.","https://www.match-maker.ventures/wp-content/uploads/2018/07/photo-1485827404703-89b55fcc595e-300x200.jpeg"
"27","https://www.match-maker.ventures/interview-with-mario-mayerthaler/","MatchMakerVentures","Corp-up in Telecom: Interview with Mario Mayerthaler, A1 Group","An insider view on corporate-startup collaboration. We invited Mario Mayerthaler, Head of A1 Group Innovation Telekom Austria, as a guest speaker to outline how A1 is approaching the startup opportunity and what lessons were learned. A1 is actively engaging with startups through its Startup Campus, as well as directly through its different business units. Why does A1 collaborate with startups? As a leading telco in its footprint, A1 is the pacemaker in terms of digitalization for B2B and B2C. Digitalization itself opens up new possibilities and we want to create the ecosystem together with startups. We see that startups are going into verticals in which we are not present, or that startups extend the value chain in verticals in which we are. As such, we are trying to create value together, offering different models of collaboration between startups and us as group. We are searching for innovation, revenues and spirit, and we are very happy with the developments. What do you point out as the key success factors for corporations wanting to maximize impact from startup collaboration? From my perspective, it is quite simple: Expectation Management: Promise only what you can deliver. It is absolute useless to promise guidelines and deals that will not come to the ground. Be honest: Some things in a big corporate take time, but as a corporate you really have to make it happen Secure your backing: If you are responsible for cooperation with startups, secure your backing and your guidance…and use it! Which main barriers still exist between startups and corporations? Most startups believe (and they must believe) that their products are the best in the world, so it must be quite easy for corporates to sell these products. But it is not. Corporates have quite high margins on their core products, and are driven by revenue goals in core business – this makes the selling of 3rd party products difficult. On the other side, corporates often do not understand that those 3rd party products can secure their core revenues in the future. This can happen because, for customers, the additional value added from a 3rd party product might make the difference between a commodity and real value. In general, of course, the way of thinking is different in itself: startups are eager and fast, corporates are slower but structured and process-oriented. These are two different worlds and that makes it all so interesting. Can you share specific success stories from A1 in your engagement with Startups? I would take out two real success stories: Parkbob Parkbob digitalizes cities, meaning that they create an on-street inventory of parking rules and restrictions. So at the moment they know, in 40 cities in Europe and in the US, where you are allowed to park and where not, where you need to pay for parking and where not, etc. They are the only ones who have this inventory, and the interest from OEMs and Tier 1 suppliers is quite high. This year, Parkbob will increase the number of digitalized cities to 100, because they have a unique technology enabling them to do that super fast. Ready2Order R2O created a best-in-class cash registry solution for all operating systems, available through a subscription model on mobile, desktop and tablet. They are a market leader in Austria and are now heading to Germany. Last year they made EUR 2,6 Mio worth of revenues, and their team is composed by 45 FTE – all that only 3 years after founding! We are really proud of that development as now we are truly picking up the pace and, due do legal restrictions, there is everywhere in Europe a need for such solutions. Overall, we see that our program is working out quite well, as all the startups have investors and growing KPIs.","29. March 2018.","https://www.match-maker.ventures/wp-content/uploads/2018/03/photo-1482747029550-096ad6aa9caf-300x200.jpeg"
"28","https://www.match-maker.ventures/interview-with-maxime-bayen/","MatchMakerVentures","Interview with Maxime Bayen (GSMA)","Learnings from the GSMA Ecosystem Accelerator Programme. Being only over a year and a half old, the Ecosystem Accelerator Programme has established a lot. They successfully educate the market about the benefits of partnerships between operators and innovators and just announced the first nine startups, that have been selected for their innovation fund. During our interview and the time, we spent with Maxime and his team working on our joint report “Opening Doors”, we could feel their passion for fostering startup-corporate collaboration and their excitement for innovative ideas in the mobile services space. We enjoyed working together and look forward to fruitful collaboration between Match-Maker Ventures and the GSMA in the months and years to come. Can you provide us with a brief overview of what Ecosystem Accelerator Programme is and what is the mission of the programme? GSMA is an organisation representing the interests of mobile operators worldwide, uniting nearly 800 operators with almost 300 companies in the broader mobile ecosystem. The Ecosystem Accelerator programme was launched in early 2016 by the GSMA with the objective to scale innovative and sustainable mobile services in emerging markets through partnerships between mobile operators and start-ups. Today in emerging markets, mobile operators have reached the scale that start-ups lack, while start-ups have the local innovation mobile operators need. The Ecosystem Accelerator Programme is aiming to scale innovative and sustainable mobile services in emerging market through partnerships between operators and innovators. What is your role and what has been achieved to date? The GSMA Ecosystem Accelerator works to bridge the gap between operators and innovators, enabling strong partnerships that support the growth of commercially sustainable mobile products and services. We are doing this mainly through two initiatives. Firstly, knowledge sharing and advocacy to educate both parties on the benefits of these partnerships and the best approach to make them successful (see our latest insight here). Secondly, an Innovation fund that provides selected start-ups in Africa and Asia with grant funding, technical assistance, and the opportunity to partner with mobile operators in their markets, to help scale their products and services into sustainable businesses with positive socio-economic impact. We have actually just announced the first nine start-ups selected by our Innovation Fund. Why does it need external help to foster startup-corporate collaboration? In the specific case of collaboration between mobile operators and start-ups in emerging markets, while some collaborations have already taken place successfully and without external help (recent examples include Eneza and Safaricom in Kenya or WowBox and Telenor in Bangladesh), engaging and setting up these partnerships remains a complicated journey for both sides. The differences in terms of culture, organisation, execution speed and expectations are tremendous between mobile operators and start-ups. Although we are convinced that this journey will become easier on both sides as a number of mobile operators are gearing up to set up clear processes and allocate staff and budget to it, in the meantime we are trying – at our scale – to enable and facilitate this journey. If you look at mobile operators in emerging markets, what are the key challenges for start-ups to successfully collaborate with MNOs and how does this differ to more advanced markets? This is what we dive into in our latest insight co-authored with Match Maker Ventures (Opening Doors: A Start-Up’s Guide to Working With Mobile Operators in Emerging Markets). There are four main challenges alongside the four steps of this engagement and collaboration journey: (1) Start-ups might not be familiar with the trends, challenges and needs of the mobile industry and the mobile operators, (2) It is difficult for start-ups to find out within their country, and their market, which mobile operator to engage with and which person(s) at this operator to reach out to. (3) Pitching to a mobile operator remains a very different exercise than pitching to an investor (which start-ups are usually more familiar with). (4) Setting up a collaboration with a mobile operator and steering it requires a lot of effort and dedication from the start-up’s side. Once again, this is even more the case in emerging markets as those collaborations are still quite rare and hence start-ups might find themselves in a situation where they are the first start-up working on setting up a partnership with a given mobile operator. Likewise what are the key challenges for MNOs? The situations vary quite significantly from one mobile operator to another depending on whether or not the collaboration with local start-ups is a key topic on the top management agenda. Today most mobile operators in emerging markets we are talking to are keen to work with local start-ups. However, they are all at different stages when it comes to turning this willingness into a reality. One critical challenge to overcome is accepting that working with local start-ups is risky and might only pay off in the long term, while mobile operators are under quarterly commercial pressure. Beyond this initial top management buy-in, challenges like human resources and know-how, but also difficulties in sourcing the right start-ups, are making this journey harder. Looking at start-ups that were selected in the first round of the GSMA Ecosystem Accelerator Innovation Fund, what are the three factors that make you believe it would be a good match with a mobile operator? As was highlighted recently by a mobile operator in a panel that we hosted at Africa Tech Summit London, it is difficult for a mobile operator to work with a start-up at pre-revenue stage. This is why one of the criteria for start-ups to be eligible in the Innovation Fund is revenue: they need to be already generating revenue. A second and critical point we look at is how the start-ups are using mobile technology in their core activity (mobile application but also USSD, SMS, IoT etc.). Lastly, one key question we ask start-ups to answer when they apply to the fund online is about the kind of collaboration they foresee having with local mobile operators, what would they need from them and why it would make sense for mobile operators to collaborate. If you think back, what are you most proud of and what would you have done differently to help start-ups and mobile operators to work together? With the programme being just over a year and a half old, when we look back only a little bit, there was initially nothing at all. So we are quite excited that in such a short time we have been able to put this programme and its team together. One of the things we want to improve on is the traction the Innovation Fund got in Asia. Close to 70% of the 400+ applications we received during the first round of the innovation came from African start-ups and 30% from Asian entrepreneurs. While this is great as this shows the dynamism of the African tech ecosystem, we are working hard now to encourage more start-ups from emerging markets in Asia to apply. For the second round of the GSMA Ecosystem Accelerator Innovation Fund, what do you expect? For the second edition, it was decided to keep the criteria as they were for the first one, specifically when it comes to the two innovation focus areas. As it was the case for the first round we will be supporting start-ups in two innovation focus areas: the Sharing economy and Services for SMEs.","10. May 2017.","https://www.match-maker.ventures/wp-content/uploads/2017/05/photo-1523240795612-9a054b0db644-300x200.jpeg"
