"","article_URL","creator","article_title","content","date","img_link"
"29","https://www.match-maker.ventures/interview-with-monika-kuschewsk/","MatchMakerVentures","Interview with Monika Kuschewsky (Squire Patton Boggs)","An expert opinion on GDPR – MMV talked to Monika Kuschewsky. Monika Kuschewsky is partner in the global Data Privacy and Cybersecurity practice at Squire Patton Boggs. With over 15 years of experience in data protection, she now concentrates on GDPR with a special focus on topics like IoT, “Bring Your Own Device”-policies, international data transfers as well as customer and employee data protection. We had the pleasure to talk to her about her views on GDPR readiness of companies around the globe and why GDPR is not the end of data monetization. From your perspective as partner in a global law firm, what will be the implications of GDPR beyond the EU? Will other countries adopt similar regulations? Already the EU Data Protection Directive, the predecessor of the GDPR, has been used as a standard in other regions of the world like Latin America or Asia, so I think there will be the same trend when it comes to the GDPR. Even more so, because of the higher sanctions and stricter enforcement under the GDPR <U+0336> there are also a number of countries that want to enable their companies to still do business with Europe and will, therefore, follow the EU data protection framework. Are the big multinationals from the US worried about GDPR at all? They for sure are closely monitoring and following this process. They have already started to adjust their internal compliance frameworks to the GDPR, because they know they have to comply with the GDPR if they want to continue to offer their goods and services in the EU. In my experience, many big multinationals are already well advanced and have built internal teams dealing with the GDPR. By contrast, especially SMEs are still in the process of figuring out if they are even subject to the GDPR. A survey conducted by Dell about a year ago found out that most companies are not ready when it comes to GDPR. In your experience, are companies more prepared today? I think that a lot more companies are more advanced in their preparation today, but I would be surprised if there are any that are fully compliant, since there are a lot of issues in flux. Some aspects of the GDPR may be further regulated by national law, like data processing in the employment context, so companies are still waiting for national laws to be implemented on those topics. And the data protection authorities are expected to issue guidance. A lot of companies have started with auditing their current level of compliance and building a roadmap on how to become GDPR compliant by May 2018 and most companies have advanced on that work plan, but they are far from being ready. There are certainly more organizations that have taken steps than a year ago. Nevertheless, we are still talking to businesses today that haven’t done anything regarding GDPR. This is not only the case for SMEs – also some larger companies are waiting for budget approval or are still trying to understand to what extent they will be subject to the GDPR and who should be responsible internally. Of course, today data protection has become an issue which is discussed at board level, but often there are no actions matching these discussions. Mostly the budgets are still the same as pre GDPR, even though the complexity of the changes that need to be made would require higher budgetary commitments. Additionally, complicating the issue is the fact that the task of making an organization GDPR compliant is often given to a person that has other day-to-day activities, leaving them with little time for this complex matter. In light of BYOD, shadow IT, or the rise of IoT devices – isn’t GDPR readiness of an organization more about education and less about strict processes? In my view, it is a combination of both, as one does not work without the other. If you look at the statistics, a major reason for data getting lost, or being leaked, is employees not being familiar with rules or making mistakes. By training and increasing awareness you are reducing the risk, but you will never get rid of it entirely by just educating staff. The best training needs to be supplemented by processes and technical as well as organisational controls. Just to give an example: You can allow your employees to bring their own device, but you will need to have a proper policy framework around it. Moreover, you need to ensure that company data is secured and, for example, only accessed through encrypted VPN channels or by using sandboxing technology. How big of an impact do you think the stricter rules for consent generation have on new business, like data monetization? These stricter consent rules are certainly posing a challenge for many new sectors and ideas such as data monetization. To the extent that companies depend on consent, certainly business will not get easier in that regard. However, the first step should be to ask whether an organization can process personal data without consent; in other words, if there is another legal basis for data processing – because it is so difficult to obtain consent. However, there are a number of business models where consent is unavoidable. Then, it is a matter of coming up with creative consent mechanisms and tools, to make the consent experience as smooth and easy for the individuals as possible. But it certainly will not be easy. Anyways, I would not want to say that this is the end of new business and data monetization. If I look at the consent rules, they are to some extent very similar to existing rules in Germany, and businesses in Germany have coped with those rules in the past. Overall, (new) business is all about inventing and creating new things and ideas, so I am confident that companies will come up with innovative ways to deal with it.","6. October 2017.","https://www.match-maker.ventures/wp-content/uploads/2017/10/photo-1459347268516-3ed71100e718-300x200.jpeg"
"30","https://www.match-maker.ventures/last-physical-meeting-in-2020/","MatchMakerVentures","Last physical meeting in 2020?","If so at least we used it for a Big Bang On the 2nd of November just one day shy from the Vienna lock-down, we welcomed our latest portfolio company Yeself from Slovakia! What is Yeself doing? Driving digital learning by leveraging machine learning and AI! We are really looking forward to bringing this collaboration to many corporate clients and help their employees to move faster and better through the digital transformation. As we are all enjoying (again) some time at our home offices without the usual interaction and support in the office, this solution becomes even more relevant to help employees at home in the most convenient and personalized way.","10. November 2020.","https://www.match-maker.ventures/wp-content/uploads/2020/11/Yeselfatthe-office-300x200.jpg"
"31","https://www.match-maker.ventures/match-maker-summit-second-edition/","MatchMakerVentures","Match-Maker Summit: Second Edition.24-25 January 2019","On 24th-25th of January we hosted our second Match-Maker Summit, 2 days full of knowledge-sharing workshops and startup pitches, networking and fun. More than 40 executive leaders and startup gurus from nearly 20 countries were brought together in Vienna by Match-Maker Ventures. The main goal of the gathering was to accelerate the Match-Maker network and foster value creation for both startups and Match-Makers. During the first day our discussion was reviving around our motto: 1+1=3. We believe that in order to successfully navigate between the two worlds you need a third party that speaks two languages – a Match-Maker (aka a duck). Why a duck? Our Match-Maker Attila Keszeg shared this wisdom with us! Ducks do not fly like eagles, do not run like leopards, do not swim like fish, but combine all of it together to successfully operate in all the three apostasies. Nicolai Schaettgen, Jens Wirsching and Joerg Floeck during lunch break We talked about the challenges that all three parties (corporates, startups and Match-Makers) face and discussed key factors that are crucial for the successful Corp-Up. Later in the day, we had a startup fair where Match-Makers got a chance to meet our amazing portfolio startups face-to-face. Daniel Soederberg, CEO of EyeOnID during the workshop Kristian and Marin Curkovic from AdScanner with Match-Maker Attila Keszeg The day ended with an evening event at one of the coziest Heurigers in Vienna, full of delicious local food and wine, breathtaking magician performances and true MMV family vibes. The second day focused specifically on our engagements with Match-Makers in order to outline possible collaboration models. We want to thank all our attendees for providing valuable input during the persona creation that will help us in further designing the network. Overall, these were the two exciting days where we listened, learned, networked, made deals and had fun. Our endless thank you goes to all participants, what a crowd! See you next year. Yes, MMV can!","31. January 2019.","https://www.match-maker.ventures/wp-content/uploads/2019/01/IMG_2264-300x200.jpg"
"32","https://www.match-maker.ventures/match-maker-ventures-helped-a1-find-new-revenue-streams/","MatchMakerVentures","Match-Maker Ventures helped A1 Telekom Austria find new revenue streams","The Company A1 Telekom Austria is a leading telecommunications company in Europe, present in eight countries and part of the America Movil Group. The Challenge A1 turned to Match-Maker Ventures to identify scaleup partners which can support A1’s revenue growth targets and to support this quest by sourcing, validating, and match-making relevant scaleup. The Solution For this 1-year engagement we developed a clear process and worked closely with the different teams to drive impact: Identification We used our global network of Match-Makers to continuously present new scaleup growth opportunities in a variety of areas. Validation We worked closely with the team of A1 to validate the opportunities and drive them through implementation. On-boarding Jointly with the team we developed the operating model and go-live roadmap. The Main Results After 12 months of cooperation, Match-Maker Ventures provided A1 Telekom Austria with: 300 high-level scaleup assessments 20+ detailed opportnity validations 8 Joint Growth Stories outlined 2 partnerships live ""A highly valuable team combining deep understanding of our corporate needs and capabilities with a unique scaleup expertise. We benefit highly from the quality recommendations and in particular the capability to drive those collaborations successfully to market."" Matthias Lorenz, Senior Director at A1 Telekom Additional Information Homepage A1 Contact us to learn more","12. July 2019.","https://www.match-maker.ventures/wp-content/uploads/2019/07/MMV-Website-Featured-Image-A1-X-MMV-1-300x200.png"
"33","https://www.match-maker.ventures/match-maker-ventures-outlining-scaleup-corporate-collaboration-opportunities-for-hutchison-drei/","MatchMakerVentures","Match-Maker Ventures outlining Corp-Up opportunities for Drei","The Company Hutchison Drei Austria (H3A) is a leading telecommunications provider serving 3.9 million customers in Austria. H3A is part of the 3 Group Europe, present in 6 European countries, and a wholly-owned subsidiary of CK Hutchison Holdings (Hong Kong). The Challenge Hutchison Drei Austria asked Match-Maker Ventures to outline scaleup collaboration opportunities which can support the objective to enter and develop new lines of business, particularly within the topics of IoT and Smart City. The Solution MMV set up and executed two 6-week sprints for H3A, aiming to create impact already within the short-term. The process was structured in 4 stages: Mapping Initial focus was on creating transparency within the complex IoT landscape. Jointly with H3A, MMV narrowed down the search grid to the IoT sub-topics with highest impact potential for H3A (e.g. Smart Building, Smart Parking). Identification MMV engaged its sourcing engine to identify potential scaleup partners for H3A, presenting only to H3A those scaleups which showed relevance across 4 points: market, scaleup-specific fit, margin potential and time-to-market. Validation After selection of the highest-potential scaleups, MMV worked with H3A’s team and with the short-listed scaleups to conduct a deep-dive assessment of the market opportunity, scaleupup solution, team and business model. Match-making For the scaleups with the strongest collaboration rationale, MMV developed a Go-to-Market plan, a joint operating model with H3A, and a detailed business case which was then presented to H3A. The Main Results New business proposition New holistic IoT proposition built for H3A consisting of 3 complementary scaleup offerings Innovation inflow 45 scaleups were evaluated along H3A’s areas of interest, being that 6 of those underwent validation deep-dives Roadmap for future innovation Significant market knowledge generated throughout the project, with the potential to be leveraged in the future by H3A’s innovation team “MMV uniquely combines in-depth telecom understanding with scaleup know-how. Out of our engagement we received a holistic proposition ready to launch together with three high-potential scaleups.Truly end-to-end Match-Making, which enabled us on the one hand to see and explore things we haven’t thought about and on the other hand to significantly reduce time to market.“ Elisabeth Rettl, Senior Head of Business at Hutchison Drei Austria GmbH Additional Information Homepage Hutchison Drei Austria Contact us to learn more","26. June 2019.","https://www.match-maker.ventures/wp-content/uploads/2019/06/MMV-Website-Featured-Image-Drei-X-MMV-4-300x200.png"
"34","https://www.match-maker.ventures/mission-impossible-making-sense-of-the-fintech-space/","MatchMakerVentures","Mission impossible: Making sense of the FinTech space!","Over the past weeks, MMV went on a mission impossible and made sense of the FinTech space! After studying dozens of research reports, analyzing in detail the business models of roughly 600 FinTech startups and applying our industry expertise we drew our simplified conclusions of the developments in the financial industry and of the complex FinTech world. Please find a summary of the most important findings and a download link for the whole report below. MMV FinTech Report DOWNLOAD REPORT","3. November 2016.","https://www.match-maker.ventures/wp-content/uploads/2016/11/Screen-Shot-2018-08-02-at-10.10.12-300x200.png"
"35","https://www.match-maker.ventures/mmv-partners-with-apiax-to-make-regulatory-compliance-simpler-for-financial-institutions/","MatchMakerVentures","MMV partners with Apiax to make regulatory compliance radically simpler","Match-Maker Ventures (MMV) announced today a strategic partnership with Apiax, a Swiss-based RegTech platform simplifying regulatory compliance. The partnership will enable Match-Maker Ventures to better serve the needs of the banking industry, with particular focus in wealth management, asset management and investment banking. Apiax and MMV will enable global banks to bridge the gap between between compliance, business and technology. “Keeping up with regulations is truly one of the greatest burdens facing companies around the world, especially in the banking sector” said Dr. Nicolai Schättgen, Founder and CEO of Match-Maker Ventures. “Compliance becomes even more complicated for organizations working internationally. Apiax is solving this by combining exceptional legal and compliance expertise with outstanding technological capabilities. This is why we believe it’s the perfect solution for the market today. What was once a cumbersome, time-consuming process will be shaved down to a few clicks and keystrokes, allowing banks to focus on delivering what really matters.” MMV will serve as a strategic partner for Apiax’s international expansion with the help of its network of over 100 senior executives around the world, who understand current banking pain points and regulatory trends. “The collaboration between Apiax and the MMV team may have just begun but it has been excellent so far. We believe it will allow us to grow our business substantially by leveraging MMV’s network of industry experts” said Andrew Campbell, CCO of Apiax. The solution of Apiax will enhance MMV’s portfolio in the banking sector, solving one of the greatest challenges the industry faces today. About Apiax Apiax is a RegTech company that makes it radically simple to comply with regulations. Financial institutions of all sizes can use its software to bridge the gap between compliance, business and technology. Through an easy-to-navigate platform, Apiax’s solution reduces costs and drives revenue while also mitigating risk in client-facing engagements and accelerating go-to-market for new jurisdictions. About Match-Maker Ventures Match-Maker Ventures (MMV) drives tangible business impact by matching the innovation power of high-growth tech companies with the assets of large corporates. Our network of 100+ industry experts enables us to identify the best-fitting solutions for the dynamic needs of organizations. Our selective portfolio comprises of 15 scaleups with impactful deployments across 50+ countries in banking, insurance, telecommunications, e-commerce and beyond. Through a thorough match-making process, MMV ensures the right partners collaborate in the right way at the right time. Additional Information Homepage Apiax Contact us to learn more","29. April 2021.","https://www.match-maker.ventures/wp-content/uploads/2021/04/MMV-Website-Featured-Image-MMV-X-Apiax-1-300x200.png"
"36","https://www.match-maker.ventures/open-innovation-fact-or-fiction/","MatchMakerVentures","Open innovation – fact or fiction?","The beautiful and ugly truth about financial sector startup-corporate collaboration The financial services sector talks notable about innovation need and collaboration with startups. Is it just a talk or is the sector truly walking the walk? With this report, which we jointly published with our partner Mind the Bridge, we shed light on what is really happening behind the scenes of startup-corporate collaboration in the FinTech/financial services sector. We reveal how deep the engagement really goes, what can be learnt from the current status quo and how startups and corporates can benefit even more from the collaboration. Our report offers deep insights for everyone interested in open innovation in the financial sector, as it summarizes our key findings on the beautiful as well as ugly truth and gives recommendations on how to take the sector startup-corporate collaboration to a new level. MMV Open Innovation - fact or fiction? DOWNLOAD REPORT","3. May 2017.","https://www.match-maker.ventures/wp-content/uploads/2017/05/Screen-Shot-2018-08-02-at-10.01.54-300x200.png"
"37","https://www.match-maker.ventures/opening-doors-a-startups-guide-to-working-with-mobile-operators-in-emerging-markets/","MatchMakerVentures","Opening Doors: A startup’s guide to working with mobile operators in emerging markets","Mobile in emerging markets is becoming ubiquitous. The number of unique mobile subscribers in emerging markets has jumped from 177 million in 2000 to 3.7 billion in 2016. By 2020, 80% of global unique mobile subscribers will be in emerging markets. While this exponential growth has turned local mobile operators into strong economic and social forces, the new digital era in which they now operate has affected their margins. In the race to stay relevant and foster growth, operators are becoming more receptive to partnerships, particularly with innovative local start-ups. Match-Maker Ventures teamed up with the GSMA Ecosystem Accelerator Programme to produce the guide for start-ups interested in collaborating with mobile operators in emerging markets. This guide walks you through the process of securing a partnership with a mobile operator in your market and answers the questions that will arise along the way. MMV GSMA Opening Doors DOWNLOAD REPORT","3. May 2017.","https://www.match-maker.ventures/wp-content/uploads/2017/05/Screen-Shot-2018-08-02-at-10.02.53-300x200.png"
