"","article_URL","creator","article_title","content","date","img_link"
"1","https://theventury.com/blog/5-biggest-crowdfunding-mistakes/","TheVentury","5 Biggest Crowdfunding mistakes (creators can avoid)","After planning and launching a couple of crowdfunding campaigns like the latest one for Pocket Sky you start to see common misconceptions connected to crowdfunding.If you’re planning to launch a crowdfunding campaign soon, make sure you’re avoiding these five major mistakes <U+0001F9E8>Crowdfunding Mistake #1: Only relying on the platform’s communityI have a great product, I set up a beautiful campaign page, even made a nice video, and then I launched …. but nothing happened! <U+0001F937> via GIPHYA lot of creators purely rely on the community of a crowdfunding platform. Let’s take for example Kickstarter with its more than 17 Mio supporters… yes 17 Mio! That sounds massive, doesn’t it? Nevertheless only 20% of technology projects are successfully funded, while raising on average less than $10,000.With great numbers comes great competition! It’s not only you who is launching but on average there are about 400 other projects online in the tech-space alone. So how can you stand out?To benefit from the platform’s community, you first have to build up your own community – before launching! So once you launch you already have your first supporters queued up. This first push is very important! It helps you to get a decent ranking on the platform, which gives you visibility to the community! Now you can start benefiting from the platform’s community.Crowdfunding Mistake #2: Not telling people that you’re launching via GIPHYUnfortunately, a lot of creators literally forget about the most obvious thing: to make sure everyone knows that their campaign has started and that they need their support now.Be prepared! Make a list of all the people (that includes family and friends) that showed interest. I recommend adding the likelihood of them supporting, so at the end you have a reliable number of first supporters. Once you launch make sure every single one of them knows that you’re live!Don’t forget to post it on your social media channels or other relevant channels, and to send out a newsletter in case you were collecting email addresses upfront.Crowdfunding Mistake #3: Not getting feedback before you launch via GIPHYOn the majority of platforms, you get a preview link of your campaign once you start setting it up. Use this link to gather feedback before you launch. Make sure you send it to people who are not yet aware of your product and ask them for feedback: Is it clear what you are doing? Is any information missing? What needs improvement? Is the video grabbing attention?I can guarantee you, there will be valuable feedback, which will help you make your campaign ever better.Crowdfunding Mistake #4: Not submitting your campaign early enoughCrowdfunding platforms like Kickstarter need to approve your project before you launch. Make sure to submit your project at least one week before your planned and communicated launch. Normally they approve or get back to you within 2-3 days. In case you need to adjust something, you have some buffer days.Crowdfunding Mistake #5: Ignoring seasons via GIPHYLaunching a solar BBQ <U+0001F356> <U+2744><U+FE0F> in winter or Skis in summer <U+0001F3BF><U+0001F334>- does that sound like a good idea? Starting in the wrong season can kill your campaign. Two main reasons: First of all, most supporters don’t care about BBQ in winter or Skis in summer. Secondly the media doesn’t care about it either. Hence it will be really difficult for you to get press coverage. Keep in mind your products “main season” if there is one and launch in that time frame.Keep these 5 mistakes in mind, and never forget: preparation is key to success!Happy launching!","March 6, 2020","https://theventury.com/wp-content/uploads/2020/04/ELEVATE_Breakfast_113-scaled-377x250.jpg"
"2","https://theventury.com/blog/5-perks-of-insurance-chatbots/","TheVentury","5 Perks of Insurance Chatbots – From Paperwork to AI","Have you talked to a chatbot before? Did you notice it was a bot? Bots have evolved to a point where they can provide a new way for customers to interact with brands – in a meaningful and useful way. Consumers crave real-time, efficient, on-demand conversations without hassle. An experience chatbots are already able to perfectly provide today.You have probably already come across chatbots (If not, you might want to check out our blog). Chatbots provide a conversational interface aimed at solving customers’ problems. In simple industries – sure. But is this also possible in more complex cases? Enter insurance chatbots.Making insurances sexy with conversational interfacesThink about the insurance industry, where there is a lot of in-depth communication needed between a business and a client. These insurance processes require time, effort and the filling of a ridiculous amounts of documents – You know the struggle and you probably hate it as much as we do!The Road from paperwork to AIWould you believe us if we tell you there is a better way to do it? By working with an insurance chatbots. To give you a better understanding of the potential of conversational interfaces in this case, let us present to you 5 things we love about insurance bots:Make a claim – 24/7 with insurance chatbotsRecord a claim from your phone and check its status at any time and any place. No calls. No repetitive hold music. No redirection to a call centre halfway around the world. The bot is there for you, 24/7 – No restrictions.Get feedback right awayThe bot will answer your simplest questions so you get feedback not 3-5 business days later, but right away. It works efficiently, quickly and is convenient. Your communication with the bot can happen on the channels of your choice, be it a messenger, mail, voice device or many others.Explain matters only onceYou know how insurance hotlines will redirect you multiple times, forcing you to explain your issue over and over again? Not with chatbots. Conversations are traceable and take protocol so humans can take over at any time.Customer service bots can create incidents and tracks issues – or can alternatively assign them to real employees should the task get too complex.Attach your documentation right awayNo need to fill out documents about how the accident happened and send photos from all angles per mail. Do all of that via bot. With today’s image recognition opportunities, the pictures can be analyzed directly by the bot and processed to further understand what the customer needs.Get information you did not even know you wanted The thing about self-learning bots is: They gets smarter with every question they are being asked! While the Bot can understand your current needs it may even suggest policies you might be interested in at the time – The bot acts as a sales person and adds value to the customer experience.Ready for the insurance revolution?We are happy to help you with an enterprise ready framework for the bots you have been dreaming of. Let’s talk:maximilian.unger@theventury.com","January 31, 2019","https://theventury.com/wp-content/uploads/2019/11/fe55a437-d8e7-493b-a5ed-e46983d67098-1024x768-377x220.jpg"
"3","https://theventury.com/blog/accelerator-businesses-and-people/","TheVentury","ELEVATE – more than a business accelerator","Elevating your business, that’s what an accelerator is about, right? Developing the business model, validating your idea as well as your MVP, exploring the KPIs which truly count, all the way to reaching product-market-fit. You want to leave an accelerator knowing your pitch, your Go-To-Market strategy and all that other good stuff. That’s the reason you want to join an accelerator in the first place and why we all pour our heart and soul into it . Over the last two batches of ELEVATE, however, we learned that there is even more to it! Personal growth. Constant feedback. A community supporting each other.Looking back on 4,5 months of ELEVATE Batch #2, there was all of that. There were struggles, intense meetup days, motivating feedback sessions with fantastic mentors and great progress in our teams. And then there were also karaoke nights, Austrian dinners, impromptu German lessons and lots and lots of chats, sharing experiences and learnings. Now that Batch #2 is coming to an end and we are already preparing for Demo Day – which is happening on May 23rd (Save the date) – it’s high time to reflect on the highlights and our favorite moments.ELEVATE Moment #1 – Kick-OffThe day we finally got to meet the new teams was definitely a highlight. Our internal IT & Growth Hacking mentors got to meet the teams they would be working with very closely for the following 6 months, supporting them hands-on, week for week. First task: Evaluating, rethinking and upgrading their business model and validating it– a painful but necessary process.Personal Highlight: Introducing the international teams to Schweinebraten & Glühwein – a very typical Austrian dish & drink – at a Christmas market. “When we joined ELEVATE, we had already launched our product, so we were very interested to continue to develop product and go after the customers. But ELEVATE made us take a step back and think more critically about our overall product and key hypotheses. As a result of that we interviewed 2 dozen real estate agents, and we got some very interesting insights that resulted in our product roadmap changes.” – Jatinder Singh, BotplanFavorite Moment #2 – Facebook in the HouseHaving Susann Fischer from Facebook, Markus Brunner from the Facebook Messenger Platform Team, Prashant Pitti from nearGroup and of course our one and only Greg Leuch from Poncho – an all-time Vienna fan – all here in Vienna for a very special mentoring day with our startups was great. Having experienced chatbot startup founders mentoring our teams and sharing their learnings was a fantastic way of giving our startups new perspectives. Ending the day with our Grand Bots Meetup was just the cherry on top!Personal Highlight: This is – again – food-related: A huge ELEVATE dinner with our mentors, teams and the ELEVATE team.Favorite Moment #3 – US Team relocating to ViennaOur team from the US, Polaama relocated to Vienna for the last three months of the program. Having the teams here full-time means work is getting done really fast, the progress is bigger – it also means fun lunch breaks and impromptu German lessons. “Some of my ELEVATE highlights: Working with the ELEVATE team assigned to me, how it feels like a real team and how much we have been able to accomplish as a team” – Madhu Parasarathy, PolaamaFavorite Moment #4 – Progress, progress, progressOur teams and mentors are working incredibly hard to making their visions come to life and making their customers’ lives easier. We know that. But some of the best moments throughout the accelerator program were the ones when we realized how much the teams and their businesses have progressed. Be it after pitching and roasting sessions, progress updates or just in between through conversations with each other. We can’t wait to see what our startups’ future will bring!Personal highlight: All the pitching & roasting sessions, when we’re a bit tough on the teams but they show us just how much is in them!Extra Moment – Karaoke Night! Yes, this has to be mentioned, because it was just too much fun. Who doesn’t like a chill karaoke night after a hard day of work? That’s what we thought, so we got our whole team and the startups together – and we went all out. It was a blast! Who would’ve thought all these people in the accelerator aren’t only talented business people, but got so many other hidden talents? Definitely calls for a rerun! “The gals and guys from TheVentury were great mentors for us. We expected that in a way when we applied. But we didn´t expect they would kill us in Karaoke :)” – Michael Nigsch, ibindoThese were just a few highlights of the last 5 months, just a few words will never be enough to describe the whole journey . So this is just a ”tip of the iceberg” kind of thing – to tell our mentors and our teams how much we value them and how much fun it was. And to give you an idea how we do not just elevate businesses, but also the people behind it.If you are interested in what our teams were working on throughout the program, then request access to our Demo Day (May 23rd).ELEVATE Batch#3 – October 2018ELEVATE is coming back in October 2018 – Join the ELEVATE family! You’ll get hands-on coaching, as well as IT-development and growth marketing support. See the program details for our Batch#3 program.","April 9, 2018","https://theventury.com/wp-content/uploads/2018/11/Pooja-Ahluwalia-on-User-Personas-377x220.jpg"
"4","https://theventury.com/blog/accelerator-opens-for-corporate/","TheVentury","ELEVATE Accelerator now open for corporate teams","Since 2016, we have supported over 20 startups through their initial growth process with our accelerator program ELEVATE. And now, for the first time ever, we have opened ELEVATE to established companies. We are thrilled to have RBI on board for our batch 6 with their intrapreneurship team. “By opening the Elevate accelerator program to intrapreneurship teams, we will henceforth offer them an agile and inspiring environment to work side by side with young startups on forward-looking ideas and business models,”– Katharina Binder, Head of AcceleratorAt TheVentury we have been supporting both, startups as well as established companies. Through the years we have experienced the parallels between intrapreneurship teams and early-stage startup teams – the similar needs they have in their most intensive growth phase and the common struggles that they face. We realized that including intrapreneurs in an entrepreneurship program will open up a valuable space of learning together and also from each other. While intrapreneurship teams can learn about the entrepreneurial mindset and increase their dynamic capabilities, startups benefit from their organisational know-how and deep industry knowledge. This is why, starting with March this year, we decided to offer selected intrapreneurship teams from large companies the opportunity to immerse into the typical startup environment of ELEVATE.De-risking innovationOne crucial attribute that corporates are looking for in innovation programs is risk minimization. Innovation is risky at its core, often associated with uncertainty and driven by assumptions. We help to derive facts from the underlying assumptions of a business model thorough testing and validation. This way, we take risk out of the implementation of innovation projects and allow a solid foundation for such investments.With our 4-month-program, we have found a way to support the development of new technological solutions in a resource-efficient way – and all that in an inspiring start-up environment with the help of agile processes and external know-how.First to join: Raiffeisen Bank InternationalF.l.t.r.: Maximilan Unger, Nicole Stroj (RBI), Aleksandra Petkov-Georgieva (RBI) and Katharina BinderWe are happy to have RBI on board and to support them in their journey of becoming the most innovative financial services provider on the market. Since March, RBI’s intrapreneurship team has been working alongside three tech startups, attending bootcamp sessions and working on their prototype with the hands-on support of our experts. The goal is to complete the program with a tested and marketable MVP – a new financial solution in the agricultural sector. “We are pleased to further drive our innovation efforts together with our partner TheVentury. Innovation is an essential part of our strategy and will help RBI to continuously and sustainably improve and optimize the customer experience” – Nicole Stroj, Head of Organisational Innovation at RBIRead the full press release (german only) here.Batch #7 planned in September 2021The next batch of ELEVATE will start in September 2021, with the second round now open to three corporates and six startups. All information about ELEVATE and pre-registration can be found here.More about ELEVATE More on the background","April 28, 2021","https://theventury.com/wp-content/uploads/2020/12/PRINT_©-Tama´s-Ku¨nsztler__TK_3082-scaled-377x250.jpg"
