"","article_URL","creator","article_title","content","date","img_link"
"12","https://theventury.com/blog/botbase-chatbot-framework/","TheVentury","The BotBase – The Enterprise-Ready Chatbot Framework","Please go to www.botbase.tech for updated information about our latest venture BotBase!Hello, BotBase!TheVentury is proud to tell about our experience in developing bots by releasing the very first blog article about our proprietary Chatbot Framework, the BotBase. Through an intense journey working with start-ups and established companies for almost two years, the development team of TheVentury discovered particular requirements that start-ups and corporates have a like.The lowest common denominator of the start-up and corporate ecosystem determine the functionalities and application programming interfaces that our very own BotBase provides.Over the last second years we developed the BOTBASE towards an interface agnostic platform that provides the opportunity to operate with a multi-platform approach that ensures a consistent user experience across channels like:Facebook Messenger, Telegram, Web Interface for your website,Whatsapp, Slack, SMS, E-Mail, Skype & Skype for Business,Voice Interfaces like amazon ALEXA. The Chatbot Framework: Technical PerspectiveFrom a technical perspective the chatbot framework is written in node.js, a programming language that is based on JavaScript. This server-sided software development platform enables the BOTBASE to create a fully-horizontal scalable and resource-efficient architecture that corporates and start-up teams require both alike.Since the BOTBASE is delivered as a dockerized application the advantages for server administrators and developers are obvious:Rapid application deployment due to minimal runtime requirements that reduces size and allows to be deployed quickly. Portability across machines since the application and all its dependencies can be bundled into a single container that is independent from often upcoming compatibility issues. Version control and component reuse by tracking successive versions and easy roll-back to previous options. Minimal overhead & simplified maintenance due to non-existing application dependencies. By deploying the DOCKER container on-premise TheVentury ensures to be GDPR (General Data Protection Regulation) compliant in terms of data-storage and data-processing. Since the requirements towards non-cloud technologies are mandatory, especially for sensitive data sets, the BOTBASE provides strong support for on-premise deployment and works seamlessly across on-premise infrastructure.As we know from talks to various corporate innovation leaders that triggering custom events such as Cronjobs and a full ENTERPRISE LOGGING are requirements that need to be part of the package to fulfill policy requirements and a seamless integration to the existing architecture and business processes.The requirements of clients from very different industry verticals led us to the decision to built our BOTBASE platform agnostic in terms of NLP (natural language processing), ANALYTICS and CRM (Customer-Relationship-Management) / ERP (Enterprise-Ressource-Management) integrations. Why is that?Because we believe that different solutions provide different strengths that can, if used and orchestrated right, be leveraged to provide our clients with the best possible solution available on the market for the demanded use-case.By integrating connectors for different Natural Language Processing / Understanding solutions such as the IBM Watson Platform, Googles NLP Solution, or our Partners such as RASA (Open-Source-Software) and DeepSearch, our clients are able to cherry-pick their preferred solution.Microsoft Azure Bot & Cognitive Services enables us through the BOTBASE to Microsoft Bot Framework integration to give our clients the opportunity to make use of their Microsoft Suite and deploy Bots for Microsoft Teams and Skype for Business with direct connection to Office 365, Dynamics CRM, and other applications without losing the flexibility that is necessary to be ready for the challenges that they might face in the future.The modular architecture of the BOTBASE makes us as flexible as our clients demand us to be. Our mantra: Always stay agile!We know how difficult it is to be flexible within a corporate legacy system. <U+0001F609>Thinking of building a bot for your project?Let’s talk: maximilian.unger@theventury.com","February 6, 2018","https://theventury.com/wp-content/uploads/2018/10/sharon-mccutcheon-532782-unsplash-377x220.jpg"
"13","https://theventury.com/blog/ceos-at-riseconf/","TheVentury","What the CEO of Tinder, Air Asia & Giphy had to say at RISE!","RISE – the largest tech conference in Asia!3 days, 3 nights, 16,000 attendees & 350 speakers!Where? In Hong Kong – where East meets West! Truly.When we attended RISE from July 8th – 11th, we did not only introduce our latest venture BotBase but also got a chance to listen to some highly influential speakers, founders, CEOs! I would now like to share some interesting insights with you!Tinder CEO – Elie SeidmanLaunching “Lite”Some months back the dating app announced its plans to expand to the Asian market. At RISE the CEO mentioned, that the next expansion was going to be in Vietnam with “Tinder Lite”. This version of the app would have almost the same features but would use less battery and data (up to 20% less than the full version). However, in order to ensure that the app works with slow internet networks, it will have to remove the “Tinder Feed”.Elie Seidman, Tinder CEO at RISE 2019A similar announcement was made by the Spotify Global Head of Markets, Cecilia Qvist, who spoke about launching Spotify Lite in Asia and also spoke about the successful expansion to India, where they were able to acquire 1 Million users within the first week of launch.The two are following the footsteps of Facebook, who launched Facebook Lite in 2015. Great examples of companies not only customizing their products in terms of content adaption to local needs but also thinking about solving issues that prevent users from having a good user experience.Now let’s talk about the real reason why you came to read this blog post. Secret tips about getting more matches by the CEO of the most popular dating app himself, right? No, of course not. We know that’s not why you are here, but just in case you were wondering, here you go:Increasing your chances to get matchedThe CEO of Tinder was asked to share the big secret. How can users increase their chances to get matched? Spoiler: it’s not really a big surprise and hardly a secret.He said that from looking at the data, it is very clear to see that people talking about their passion in the bio field have a higher success rate than users who simply upload a head-shot image. There you go. He confirmed something that has been a long-time rumor. Uploading a picture alone apparently is not enough.He also mentioned how “the desire to create a human connection is not a new idea” when he was questioned what intentions he had while founding the company.Besides launching the Lite version of Tinder, GDPR has also been on Tinder’s agenda in the past months. “We choose to comply with GDPR globally”, he explained. They have aligned users in protecting their data while helping them find online connections. It seems that GDPR compliance is becoming a feature rather than it just being about privacy.AirAsia CEO – Tony FernandesThe Malaysian low-cost airline is headquartered near Kuala Lumpur and is the largest airline in Malaysia by destinations. What makes the company as successful as it is? The CEO Tony Fernandes shared his secret to success at RISE with the audience and wow, he is one of the best story-tellers I have ever come across.PeoplePeople are at the core of innovation and success, Fernandes explained. He shared that keeping an open door and ensuring the development of his staff is what enabled AirAsia to reach the height of success that it has. Caring for the staff is critical and not something you do because it’s “nice”. My personal highlight – him mentioning how you have to look worse than your employees in order to be approachable. By that he meant “dressing down” rather than showing up to work in a suit and tie every single day. Tony Fernandes, AirAsia CEO at RISE 2019Simplified BrandingWhat played an important role for AirAsia was also the evolution of its brand identity, Fernandes explained. “Coca Cola only has one logo, so does Shell or Apply” – then why invest in multiple images or logos? Keep it simple. He simplified the branding and created a strong identity by sticking to one color and one logo only.Giphy CEO – Alex ChungAnother really great speaker, Alex Chung, CEO & Founder of Giphy. If you are ever at a conference where you see his name on the Agenda – make sure to attend!In a round-table session, that he was leading he was asked about his secret to success. His answer: “I worked on 200 different ideas, this one worked out and took 5-6 years to become successful”.Well, that was a very honest take, people thought, who were hoping to hear something more magical. I guess the magic lies in the product and the ability to integrate it on different platforms. Starting from Facebook, Whatsapp to Zendesk. Alex Chung explained how messages that include gifs have an 80% higher response rate than text-only messages. Everyone talks about the growth of video, gifs are part of the same medium.Alex Chung, Giphy CEO at RISE 2019GlocalizationWhen asked about whether users would use “local” gifs more, Chung explained that emotion-based gifs would work equally well if they weren’t local but when looking into action-based gifs, local content would work better.Here are some fun-facts:There are differences in the use of gifs in the morning. In India for example, there is a huge spike for “morning gifs”, since Indians tend to send each other “good morning” messages on a daily basis.In the United States, the coffee gifs are most popular in the mornings.In Korea, people don’t send gifs in mornings at all.To sum it up3 very different companies, 3 very different CEOs. What they all had in common? Their focus on creating better user experiences, strong brand identities and thinking globally by adapting to he Asian market needs.More blogs from our Asia trip:Also have a look at what the which Tech Trends were discussed by Uber & Googleand what we learning about Innovation in Hong Kong & China. ","July 16, 2019","https://theventury.com/wp-content/uploads/2020/03/photo-1512446387219-99c19f8fe95f-377x250.jpeg"
"14","https://theventury.com/blog/chinahongkong/","TheVentury","Exploring innovation in Hong Kong & China!","10 weeks ago, we decided we needed to explore the Asian market while preparing our pitch for our latest venture BotBase at the RISE conference in Hong Kong.Why the interest in the Asian market? Well because if you think about it (and its size), it almost feels ignorant to not be interested in a huge market with a lot of potential. We decided to pitch BotBase at RISE and use the two weeks we are there to explore Hong Kong, Shenzhen and Shanghai.What we learnt on our first few days there already: there is a LOT that is going on there. We got to see and understand many cool things happening in the innovation & start-up space. What exactly did we find particularly interesting there? Well, we have put together our key learnings, experiences of our trip and the most impressive facts for you.<U+7CA4><U+6E2F><U+6FB3><U+5927><U+6E7E><U+533A>Greater Bay Area – Market power & sustainabilityLet’s begin with the famous “Greater Bay Area”.Bay Area sounds familiar, right? But why “Greater”?In 2017, during the 13th five-year plan for economic and social development, China announced to form a megapolis that consists of 9 cities and 2 special administrative areas, kind of a megacity in the already most dense region of the world.The goal: to foster economic potential condensed in an area with combined 70 million people, nearly 5 percent of the overall mainland china population that occupies less than 1 percent of china’s land area but contributes 12 percent of GDP.This really Is GREAT, right?9/9/6The government of mainland china takes innovation seriously. Politically, as well as economically a basis to foster entrepreneurship in all different kinds of areas Is truly provided.Moreover, the entrepreneurial zeal of the Greater Bay Area is hard to compare with other hubs in the world. Even if you hustle hard!Ever heard of 9/9/6?China always had the reputation of putting work before life.9/9/6 at a Chinese company means that the workday starts at 9am, finishes at 9pm, with an extended 6-day week.One of the expat founders from the United States who we met in China simply described the ‘brutal truth’: “My engineering team works hard. There are some of the brightest minds in our industry and they grind daily. You still can’t compare it to a start-up driven by the Chinese 9/9/6 culture. If you work hard, they will work harder. It’s pure competition.”<U+9999><U+6E2F>Hong Kong – one country, two systemsWe spent most of our time in Hong Kong and truly fell in love with the high energy of the place. What we heard almost every day during our time there was people referring to their constitutional principle “one country, two systems“. Within the People’s Republic of China, socialism is maintained, while Hong Kong can retain the capitalist system after peaceful unification.If you look at the start-up ecosystem and take a closer look at the corporate innovation projects of established companies in Hong Kong, this difference to China becomes very clear.Many projects revolve around Blockchain, Fintech and other fields that require much more liberal conditions which are available in Hong Kong, more than in other parts of the world. Not without good reason, Hong Kong has been ranked number one among the economically most liberal cities in the world for several years.Starting a business there Is very easy and only costs ONE obligatory Hong Kong dollar. Yes, we completely understand If you are now considering opening an office In Hong Kong. We were constantly playing with the same thought. They make managed to make It very tempting for entrepreneurs.This is probably also the reason for the booming start-up ecosystem in Hong Kong. Last year alone +150% more startups settled in Hong Kong, over the last 5 years 300% more jobs were created in startup related companies. <U+6DF1><U+5733>Shenzhen – A full end to end ecosystemNow let’s look at one of the most interesting cities I have ever been to. Seriously!Back in the 70s Shenzhen was a tiny fishing village with a population of around 30.000.Around 10 years later Shenzhen became China’s first special economic zone, which made Shenzhen grow on an astounding rate year per year. Latest estimates count about 12,500,000 people living in the urban area of Shenzhen.Basically, Shenzhen became the number one hub for serving the world with electronic consumer goods, the biggest hub for hardware startups and the gadget factory of the world.Although there is good reason to skeptically question the development of Shenzhen, the growth miracle “made in China” produces the highest per capita income in whole China, lifted (together with the whole economic development of China) around 800 million people out of poverty.But Shenzhen is not only about economic growth!Maker Spaces in ShenzhenMakerspace “Troublemaker” in ShenzhenThe advantage for start-ups from all over the world that drives them to Shenzhen becomes clear when talking to entrepreneurs in one of the in the city located Maker Spaces.A hardware entrepreneur (start-up still in stealth mode) from California told us: “Compared to the US, we can make our products four times as fast with a tenth of the costs. The time of the ‘copycat stereotype’ approach is over – the Chinese ecosystem understands quality more and more as an advantage and focuses on increasing in this area.”Learn more about Shenzhen in a nutshell here:SummaryIn retrospect, our trip to Hong Kong and China was very educational and really widened my horizon. We were able to bring back a very different mind-set of some highly inspiring people we met there and are looking forward to maintaining the relationships we built there.In numerous conversations it became clear to me that China, also due to the strong influence of the government in economic topics, pursues a clear focus with a lot of power: Interdisciplinary collaboration and a stable infrastructure provide the basis for rapid growth, sustainable development and a perspective that may leave the West far behind.China is creating a new sense of community on the road to an affluent society. ‘Don’t give a hungry man a fish, Give him your fishing rod.’More blogs from our Asia trip:Also have a look at the insights the CEOs of Tinder, Giphy & AirAsia gave at RISE and which Tech Trends were discussed by Uber & Google!","July 23, 2019","https://theventury.com/wp-content/uploads/2020/03/photo-1512446387219-99c19f8fe95f-377x250.jpeg"
"15","https://theventury.com/blog/choosing-an-accelerator/","TheVentury","4 things you should consider before joining an accelerator","If you have founded a startup, have just started working on an idea or are trying to find to expand to a new market, you might considered joining an accelerator. But when’s the right time to join one? And which one is the right one for you?Running ELEVATE, our accelerator for early-stage AI startups and for almost 4 years now, we have read through hundreds of applications and interviewed almost as many startups. Running a community of different accelerators, we know how diverse accelerators can be and how hard it is to pick the right one for your startups. So today, we want to give you some pointers on what to pay attention to when picking your accelerator. Let’s get into it.The stageThere are definitely differences in the stages accelerators focus on. From problem-solution fit, to investment-readiness, to partnering up with corporates on concrete projects, different accelerators have different target stages.So before applying for an accelerator think about the stage you are in, your goals for the next year and the steps you need to be taking to get there. Does the accelerator fit these goals and next steps? Will it help you get there? If you are not sure, reach out to the accelerator team and ask. This is also a great way to learn more about how they interact with their potential participants.The focusPick any topic that comes to your mind and I am pretty sure there is an accelerator for it out there. Specific industries, problems they are focusing on solving, technologies, you name it. Pick a focus that’s important for your startups’ future and growth. Whatever the focus is, you’ll meet lots of other people from the same area there. Startups working in the same field or on the same technologies, experts & potential clients from that area, so pick it wisely.The offerThere are different accelerator models out there – some invest money or working time, some offer advice and workshops, some take equity, some don’t. Again, think about what you need at your stage. Money is usually the shiny thing that attracts startups first, but make sure to look beyond the surface. Is money really the thing you need most at your stage? Maybe the access to a network of investors and/or potential clients is more important at your point? Other accelerators invest in hands-on services, helping you build and grow your product.Check them all closely and ask yourself if the value you get out of it is worth it to you.The peoplePay attention to the interactions you have with the accelerator. Be it answers to your first emails or later on in your interviews. Are they asking you interesting questions? Are they genuinely interested in what you are doing? Are they adding value in this phase already, maybe challenging you, maybe giving you advice?Depending on the accelerator, these people might be invested in your startup in the long run. So make sure you would be happy having them on board for longer than the duration of the program.A great way to learn more about the people but also the overall value of the program is to talk to alumni. Just ask the accelerator team for a connection to some alumni. In most cases, this won’t be a problem and will give you another chance to observe how they interact with their alumni.ELEVATE Just in case you were wondering about how our accelerator works…For ELEVATE, we focus on early-stage startups working on AI solutions. Given the stage our startups are in, we are specifically looking at the team and the progress they have made so far. What we are specifically and most importantly asking ourselves in the interviewing phase are the following things:Can we add value for this team at their stage, with their specific needs and their set-up?How is the team dynamic within the team? Do we think this team is flexible enough to work with curve balls? Would we like to work with this team on a personal level?When have they started and what have they achieved so far? What are their biggest learnings from the early stage and how have they adapted to it?You can find out more here: elevate.theventury.comWe hope this short article will help you to pick the right accelerator for your startup. Let us know what you think in the comments and don’t hesitate to get in touch if you have any further questions.","December 22, 2020","https://theventury.com/wp-content/uploads/2021/04/Batch-6-377x250.png"
"16","https://theventury.com/blog/chooter-learnings-achievements-fups/","TheVentury","Chooter | Learnings, Achievements & F***Ups","Chooter & its value proposition: The student’s among you will know what I am talking about – Preparing for entry tests to university and preparing for your first graduate jobs is hard. Like, annoyingly hard.The odds are stacked against students who don’t have enough preparation or information on how to prepare.This is the gap that David Coates tries to fill with Chooter. His A.I.-driven tutoring tool provides individually fitted classes based on your target university and personal knowledge.In his post-month-1 interview he told us about the biggest learning he had as well as his F***-Up.50% off on MarketingThe learning that astonished the CEO of Chooter the most, is the fact that marketing does not have to be expensive. Naturally, thinking about marketing, stuff like Google Ads and Facebook will come to mind. But virality isn’t bound to the amount of money spent!Are ads really the best way to reach your audience? Chooter’s target audience are students, a group that is already actively discussing the problems that David solves – So it makes sense to be active on these Social Media pages – To take part in the discussion and finding potential leads. Cost = 0€Think about what’s most effective, not what has the most splash in your bank account Underestimating existing business contactsThe main mistake David talked about occurred during the validation phase: Obviously validation requires doing extensive market research as well as approaching possible users and competitors to receive feedback.Now – being keen on doing all that – David forgot a rather simple thing: There’s usually already people that did the legwork! There will be people that operate in the same field and may be willing to share some valuable information.So be sure to check with other companies that might already have gained insight in the topic – You might save time and money.The problem with remote staffDavid is working together with various students from all over the country: Young and talented people that are keen on helping with the project. The problem: They are scattered all over the country!Now, meeting everybody in person would have required much time – time that David did not have. So he skipped on meeting his employees and experienced the #1 problem of working remote: The staff will quickly feel disconnected from the project rather than feeling fully involved. That’s why he can only emphasize: Keep the people close and take the time to get to know them in person!Month 1 – The verdictDavid states he learned a lot in the first month and underlines the importance of staying open minded. Especially in the validation phase he learned to be confident in his product, but never being afraid of being wrong. In perfect ELEVATE-fashion he ended the interview with a great tip for future participants:Build – Measure – Learn and you will fit in perfectly with the ELEVATE team","November 30, 2018","https://theventury.com/wp-content/uploads/2019/03/lean-startup-summit-2-377x220.jpg"
