"","article_URL","creator","article_title","content","date","img_link"
"30","https://theventury.com/blog/how-to-make-bots-that-dont-suck/","TheVentury","Smartup Time  – How to make bots that don’t suck","Smartup Time at TheVenturyAt TheVentury, we believe that investing in the development of our employees is key to create value for our customers and the community. This is why we recently started to block four hours a week for every Venturer to do some research and gain new knowledge in fields where they want to improve, or in which they are interested. We love to learn new things and are proof that lifelong learning is not just an empty phrase. Since we try to give our clients as much knowledge about their project as we can, people are also highly encouraged to share their insights and takeaways from their research with their colleagues in form of small talks or workshops. In that way everybody benefits from the new gained knowledge of others, which also has a direct effect in improving our daily tasks and projects. This time our focus is: bot design.Simon Morel on Conversational Interface DesignOn Friday, we were lucky enough to hear from bot designer Simon Morel, partner & Head of Product at BotSupply some insights on how to make bots ‘that don’t suck’! The key takeaway is that when you are developing chatbots, you are designing an experience for the user, and you need to ensure that you’re adhering to design principles that have evolved in other spheres. Bots should be for everyone, and you need to design them appropriately.Simon was keen to stress that bots are just a small part of AI-powered solutions, which will fundamentally change how we interact with computers – bots are, in many ways digital spokespeople for brands and organisations, and they should link to other AI-powered solutions within this role. This means that for bots, conversations are at the forefront of the way that users interact with the AI, so the focus on design needs to be on that, before you even get to the AI.In the same way that we saw the transition from digital to mobile, we’re going to see the transition to AI, an insight also noted by Amir Shevat in Designing Bots. No industry is going to be unaffected – we won’t be able to imagine life without it. Simon’s perspective is that a chatbot is not just a bubble showing up on a website or within Facebook messenger, we don’t want to be limited. Current criticisms of bots tend to assume a simplistic view of bots, and don’t take into account that bots will soon use not just text, but also voice, eye movement, facial expressions, body positioning and hand gestures, and that AR and VR may soon have a big part to play, though Simon lamented that in Denmark, support for Danish voice conversations is lagging behind a bit!You don’t need a computer to start designing a botSimon pointed out that when you’re designing a bot, you need to start with an analogue fashion (pencil and paper) – it’s faster and more accurate, and makes it easier to start working on the bot immediately. Don’t start with the copywriting or the character, since they will change rapidly and are no good as a foundation. Instead, start with conversational flows, and literally draw them as flow charts. Only once this has been finalised do we move onto the digital stage.Apply the principles of character design in games and filmAfter this, you can design the character. Though sometimes we as designers don’t get to create the character at all, we should try to use what the medium of chatbots affords. Every interaction with the character should take the person into account that they are trying to imitate – what is the brand, what is the person, how do they sound? If this sounds familiar, it’s because these principles follows those of character design from games and film, and the lessons learned in that medium are just as applicable here.The bot’s function follows the data and the designOnly after all this has been completed, Simon emphasized, we move to AI. AI must follow everything else, but it can’t be forgotten – if we don’t have any tech between the data and the design, it doesn’t matter how well-designed the concept is! Designers need to remember that AI isn’t magic, though. If we want a chatbot to be super-specific, then we need the data to back it up, otherwise we can never train the AI.Finally, Simon closed by looking to the long term, and how to ensure that a bot doesn’t just die out as a flash in the pan. He returned to the idea of character design, and he questioned whether that should change as well? How do you do it without annoying the customers, and without people losing interest? Ideally, he stressed, you’d have 5-10 utterances of the chatbot’s phrases, and everything else should be subject to discussion with the client or designer. If users aren’t interested, that might be because of the service, but it might be because of how the character presents itself.Since you read until here you are maybe interested in bots in general and writing outstanding characters for bots? Well, we are looking for a Character and dialog writer for chatbots to join our team!See full job offer and apply now","April 19, 2018","https://theventury.com/wp-content/uploads/2018/11/eastcode-377x220.jpg"
"31","https://theventury.com/blog/how-to-use-tiktok-marketing-for-your-startup/","TheVentury","How to use TikTok Marketing for your Startup","TheVentury recently had the pleasure to host Sophie Pineker, responsible for Community and Partnerships Europe at TikTok, for a super informative workshop here in Vienna. TikTok with its 5.5 million active users, is one of the fastest growing social networks in the world. The insights we gained were really valuable, and I thought we’d share a few with you!What I found most interesting was that TikTok does not prioritize videos made by your friends or people you follow in your feed. I’ll describe more on that below.You can’t ignore TikTok – let’s look at the numbersIf you haven’t heard of TikTok yet, it’s about time! With 5.5 million active users, who spend an average of 50 minutes on the platform every day, this new social media platform is growing bigger and more relevant by the day. The Verge calls it “a unique hybrid somewhere between Vine and YouTube that’s captured the cultural zeitgeist among teenage smartphone owners in unprecedented fashion.”TikTok boasts 9 billion monthly video views, creating the perfect platform for people – especially young people – to get their creative message across, but also for brands looking to connect with the next generation in a meaningful way.Typical content on TikTok is in the shape of 10-15 second videos, often accompanied by popular music tracks, and typically humorous or entertaining, so the bar is high for brands who want to build a following on this platform.There are a few social features that make the app unique, and any brand who wants to conquer the TikTok world needs to find a way to use them to their own benefit.The different formats1. First off: the “For You” page (#FYP) is the first thing a user sees when they open the app (even before logging in or registering!) Content here is algorithmically curated and anything that ends up here is bound to get way more exposure. It’s the goal of many TikTok users to get their content onto the For You page.2. TikTok has licensed a lot of excerpts from popular music and offers in-app video editing and effects. The result is a signature style of vertical video content that spans the entire platform, and makes it both recognizable and easy to replicate. Many brands are successful, not by producing high-value professional video content, but by simulating the hand-held amateur style of its own target audience. Essentially, the challenge here is to make your brand become “one of the gang”.3. Hashtag Challenges are the heart of a lot of the content published on TikTok. This is where one user posts a video of a specific style, and prompts other users (via a hashtag) to recreate the video concept, each putting their own unique spin on it. Brands can also sponsor a hashtag challenge, and in one example presented to us, TikTok even helps to connect brands to influencers, who can give the Challenge the initial momentum it needs to go viral.4. Duets are also a popular way by which you can publish your rendition of a song or video. The resulting post is a collage of your own video, side-by-side with a number of its predecessors.A lot of these features are a little difficult to explain – I recommend you just download the app and try it out!Paid ads on TikTokUnlike Facebook, Instagram or YouTube, TikTok doesn’t offer “self-service ads” to brands who want to market their products. It isn’t possible to log on, upload a video, set a budget and target a chosen audience, and have your ad delivering an hour or two later.Why? This is possibly due to the app still being relatively new – we may see them adding an ad option in that sense once the product matures a little. But for now, businesses need to be in direct touch with TikTok to get their paid content campaigns onto the network. TikTok even supports brands with creating content, so it can feel as native as possible.But this also means higher entry costs. In the example presented to us in the workshop, a well-known brand paid a five-digit sum to run a “Top View” ad, which is a format that completely covers the app interface when a user opens the app, and links to an external landing page. The estimated CTR lay at around 12%, and 3,7 million impressions were reached. Of course, these numbers vary by region and on a case-by-case basis (you can contact them if you’re interested). That level of exposure is fantastic for any brand, of course, but it naturally comes with a price tag.Organic reach for brands – Authenticity is king (or queen)Of course, if you’re a startup, those kind of costs may be a little risky, if not completely impossible to afford.Which options does that leave startups then? Organic, of course! Ask yourself: how can your business navigate the various trends, memes and challenges that dominate TikTok, in a way that makes you come across as a relatable and human user, while still bring across the brand message you want to bring, and in a perfect world, even converting users to your product?That’s the big question, and it’s going to take some experimentation to answer.It’s worth taking a look at some of the approaches brands have taken so far. Companies like Chipotle, the Washington Post or Guess have all been among the earliest adopting brands on TikTok, and each have given a unique spin to their content, while keeping the authentic, casual, humorous core that makes TikTok videos so addictive with its target audience.Approaches included:Engaging in existing Hashtag Challenges while featuring their productCreating their own Hashtag Challenges and boosting them with influencer participationCreating branded filters or stickers that other users can attach to their contentFunny “behind the scenes” posts from their officesHigher production value sequences involving influencers and celebritiesWhatever you choose to do, the golden rule is simple: try to make your brand feel more like a real life TikTok user!TikTok is about content, not connectionsThere’s one more thing that makes TikTok stand out from the rest. Where other social networks have been betting on the social graph, the model that represents interconnectedness of people online, TikTok content becomes successful by other virtues. On the For You page, TikTok’s algorithm decides what you’d like to see. It doesn’t prioritize videos made by your friends or people you follow. The videos are built by influencers, brands and random people trying their luck at TikTok stardom. Whether or not you get to see their video is defined by its overall popularity and its popularity in your region, not by how socially close you are to the creator.This can be great for brands – if they can manage to create awesome content, they don’t need to worry about it getting buried by content from a user’s social connections – this continues to be a challenge on Facebook, for example. The success of a given piece of content is much more strongly defined by its objective popularity and engagement.At the end of the day, TikTok is still in its early years, and it remains to be seen what features will still be launched, both B2C and B2B. But with its current rate of growth, its predominantly young following, and its features that set it apart from what’s already out there, ignoring it might be a mistake!Have you considered using TikTok for you brand? Let me know about your experiences!","March 6, 2020","https://theventury.com/wp-content/uploads/2020/05/computer-767776_1920-377x250.jpg"
"32","https://theventury.com/blog/ibindo/","TheVentury","Meet the teams: ibindo","Last month was the kick-off of our 2nd Batch of ELEVATE – Europe’s first Bot Accelerator. We really are bursting with excitement about our 5 new teams from 4 different countries and feel thrilled to introduce them to you too. So that’s what we’re going to be doing over the next couple of weeks.It’s time for another team introduction. So let’s talk about ibindo, a chatbotservice on FB Messenger that helps people who are love sick. It combines systemic and behavioral therapy to guide and support affected people through the four phases of love sickness. Team ibindo consists of four lovely, diverse members from Vienna and Munich.Mel, one of the co-founders is a therapist who helps love sick people to understand their own emotions better and have a positive outlook. ibindo should do exactly that. What are your favorite chatbots?Mica (“the Hipster Cat Chatbot is a venue recommendation bot”) and Woebot (“an automated conversational agent chatbot who helps you monitor mood and learn about yourself”).If you were a bot, what would your purpose be?To help all people in the world to deal with their emotions. To give them a 24-7 platform.What’s ibindo’s superpower?The implementation of systemic and behavioral approach into conversational design is definitely ibindo’s superpower.What is the problem you are solving?Everyone knows the feeling where you want to simply talk about your break up. Not just for the few days after that but for a longer period.Our solution helps people who are lovesick, be it after a breakup or a divorce or in case of a unfulfilled love or ‘ghosting’. The chatbot is always there – unlike a friend who you may call once or twice in a moment of weakness at 3am. ibindo can always be approached.Do you have any advice for peers interested in building a bot?Make sure to start with an easy-to-build prototype on a standard platform, gather as much feedback as possible and then take it from there.What are your expectations for the ELEVATE program?Our goal is to launch the chatbot succesfully in the DACH region by the end of the program and are very excited about that. We can’t wait to see how many people ibindo will help in the future! ","December 28, 2017","https://theventury.com/wp-content/uploads/2018/03/chatbot-4071274_1280-377x220.jpg"
"33","https://theventury.com/blog/interview-with-greg-leuch-from-poncho/","TheVentury","1:1 with Poncho’s Head of Product – Greg Leuch","Poncho is the worlds sassiest weather bot! A cat, named Poncho talks to you about a whole slew of things: weather-related and not.Greg Leuch – Poncho’s Head of Product and R&D – is one of our beloved ELEVATE mentors and sat down with us on his recent Vienna-trip to share his insights about bot design, onboarding, growth hacking and the future. Got a cup of coffee ready? Sit back and enjoy Greg’s interview!What is your most valuable tip or trick?Be real & be respectful! You cannot build a product, regardless of its content or medium, without being honest and respectful to your end users. If you assume too much, send too many messages, disparage them, or you’re just annoying, your product will not work. Act natural like a casual friend will always do better than any other conversational messaging strategy. Be real & be respectful! What’s your favorite thing about chatbots?I honestly enjoy that chatbots can be many different things depending on their use case. They can be available in a variety of formats, from voice skills to SMS notifications. Chatbots have the power to reach the user like any other person in their preferred messaging app.What I enjoy even more is knowing that we’re still in the exploration phase of how conversational interfaces can impact everyday lives. Newer technologies like augmented reality and holograms combined with conversational practices can bring a richer, more engaging experience that far exceeds what has been capable in the past 20+ years of the Web. The exciting times are just around the corner and we have the ability to make the future right now. What’s your all-time favorite growth hack you experienced at Poncho?There are many great engagement tactics you can explore with read receipt events that can be used to target additional content. You’ll see Poncho use these from time to time. But really, the best growth hack is to make your chatbot relatable with content and characteristics that build a bond with the user.The best growth hack is to make your chatbot relatable with content and characteristics that build a bond with the user. What would your go-to career choice be if you weren’t working in the chatbot space?Oh wow…what a tough question! I would likely be exploring other technologies to see how we can build playful yet useful engagement and tools for personal enrichment and utility. According to you, what’s the most crucial thing for a chatbot to work?The absolutely most critical component for any chatbot is the onboarding experience. It is the only way to get a user started. Any user that is unable to get onboarded will very likely never come back to chat. Your onboarding could fail because of language differences, wrong content, too many questions/friction, or may not be exciting, respectful, or real. Make a great onboarding experience and you’ll be rewarded with lots of further potential conversations with those users. What’s your first advice to someone who tells you they want to build a chatbot?My first advice to anyone building a conversation interface, whether bot, voice skills, or other conversation interaction is to not get overwhelmed with natural language (NLP), machine learning (ML) & artificial intelligence (AI). Many conversations can be handled through simple call & response dialog flows. You don’t even need a bot to start — just start messaging your friends and test yourself! Can you describe the Chatbot scene in Vienna in one line?The Vienna chatbot community is incredibly smart and supportive. Not only those in this space, but also for international colleagues like myself that have been warmly welcomed into the community. (You’re all amazing!) What’s happening at Poncho in 2018?I’m excited for our upcoming launch on Slack. Our team has spent a lot of time learning about what makes Poncho a great one-to-one messaging product and applying that into a multi-user workspace. We’re adding a lot of new exciting features to be more than just a weather bot. If you are interested, sign up to get notified!We’ve also launched a Developer API for select partners for our weather content & data. Sign up as well if you’re interested. ","February 5, 2018","https://theventury.com/wp-content/uploads/2018/08/whatsapp_api-377x220.png"
"34","https://theventury.com/blog/jumpstart-theventury-awarded-funding-for-their-work-with-start-ups/","TheVentury","JumpStart – ELEVATE awarded funding","They shoot, they score! Another investment round of JumpStart has passed: The prestigious funding programme of Wirtschaftsservice Austria has chosen five accelerators and incubators to invest into – TheVentury being among them.Rough competition24 accelerators and incubators from all over Austria applied for funding from the accelerator – five of which are going to receive it. This decision was made due to the winners not only providing office space. Much more do they provide consultancy and guidance along the way; consultancy that is individually hand-crafted to each and every one of their innovative startups.Besides of Female Founders, an especially gratifying pick – empowering women within startups is a long-term goal within the entire community – there were two other start-ups among Viennese awardees: Lemmings and TheVentury.Picking TheVentury was not a hard choice to make. The packages provided to each batch’s participants – composed from cutting edge technical development, growth marketing as well as innovation consulting is unique in the industry. Thanks to this choice, we have the privilege of sharing our expertise with startups more extensively – while also further deepening our knowledge.The JumpStart credo To implement their ideas, Start-ups need more than financial resources. They need an environment that empowers them to concentrate on their projects while being connected with the Startup community and exchanging know-how.That’s why aws JumpStart only invests in the best incubators and works towards creating the optimal environment for young Startups to prosper. Even going the extra mile: The next round of investments is all about Startups themselves.Emphasising on building this prosperous environment even more, up to five companies in accelerators will be selected and will receive 22.500€ in funding. Which means: ELEVATE’s contestants are eligible as well and are at a good chance of receiving additional funds.So stay tuned:TheVentury will definitely be one of the major players at the next round of JumpStart.","November 20, 2018","https://theventury.com/wp-content/uploads/2019/03/machine-learning-prague-topic-modeling-377x220.jpeg"
