"","article_URL","creator","article_title","content","date","img_link"
"50","https://theventury.com/blog/myaustrian-messenger-service/","TheVentury","How we built the Austrian Airlines Chatbot","The idea to the Austrian Airlines Chatbot was born right after the announcement of Facebook opening up their Messenger API. To us it was crystal clear from the beginning: this is going to be huge! And because we already realized a rather big innovation project with Austrian Airlines (see flymeto.austrian.com) we approached their social media agency ambuzzador to partner with us once again to bring this innovation to Austrian.Said and done. Austrian Airlines were very quick in realizing the huge potential and allowed us to start the project.What should we do? Where to start when building a Chatbot?There were some major decision to make in conceptualizing the Chatbot. First, there was the question which functionality we should provide. What is the scope of the bot? We quickly identified that a minimal viable bot (MVB) for an airline should:be able to search for flightsprovide excellent answers to the top 5 customer support questionsbe able to handle other questions reasonably welldo small talk on a basic levelKeep in mind that this was the MVB specification. It was clear from the start onwards, that we wouldn’t be able to handle 100% of the requests successfully. So we needed an additional option:If the bot fails, hand the conversation over to a human agent for further processingThis system differs entirely from the setup that KLM is currently believed to operate on, which is: Let an AI make a suggestion and a human sign off on the message. While it is obvious that their system (for now) is more precise – because a human is still in the loop – the future potential makes our approach more powerful. Only in a solution like this one can fully materialize the potential of an AI, but keep the human capacities for edge cases and complicated requests.Hello, who is speaking?Now that we knew what to speak about, the next question was: who is speaking?There are two main strategies here: a) You create an avatar, and let that avatar speak b) The brand speaks for itself Both have their advantages and disadvantages and I leave that to another discussion, but in the end we opted for B with Austrian Airlines: the myAustrian Messenger Service was born. Interesting side note: The decision was made not to use the word bot in the name, because Austrian Airlines users aren’t accustomed to this term yet.Ok great, but how do we speak?So now that we clarified what to speak about and who is speaking, we arrived at the question: How do we speak? Most companies have a set of rules for their Corporate Design – but now we are talking text. So you need a “non-visual branding guideline”, which, in most cases, exceeds the guidelines in a Corporate Design handbook. And that is exactly where our partner ambuzzador comes in. They provided the domain specific knowledge for Austrian Airlines, which includes standard greetings like “Servus” or certain ways to communicate. This domain knowledge is always an important part of the personality of the bot. Because only the personality makes the experience something unique and hopefully outstanding.MVC <U+2260> ChatbotAfter clarifying all the personality and soft parts, we finally had the go for the hard parts – building the chatbot. But soon we realized that we had a major problem: A classic MVC (Model View Controller) structure of software projects doesn’t work! What is your controller? – You only have 1 view (the Messenger API so to say). It was really hard for us to press the structure of a bot into this excellent model of building software. So at some point we gave up and did what every developer does: Rethink everything! What we came up with is, IMHO, a clever system to structure big bot architecture: a lifecycle model. Only in a lifecycle model I have the possibility to hand over messages from different packages to another to facilitate a structured processing of the input to the output. The Austrian Airlines Bot therefore has 4 lifecycle modules:EnhanceUnderstandKnowledgeDecideEnhanceIn this first model we aim to correct and “enhance” – duh – the user message. We convert payloads to objects, emojis to a readable format etc. This is also where you correct spelling and grammar mistakes, or add additional context information for the next module.UnderstandIn the “understand” module we try to understand the user intent and extract entities we are working with. This is mainly done by the NLP/AI service api.ai, which was recently aquired by Google. We decided to go with api.ai because back then, when we did our market analysis, they were the ones we felt most comfortable with concerning the quality of their modeling (though they are expensive). In addition to this external service we had to work around a couple of glitches and specialties of the platform to correct and further customize the results with our own little NLP engine. This was necessary since a general AI/NLP provider can’t handle all the cases we wanted. Here is also the point in the software where we try to generate a first answer to the user.KnowledgeIn this module we aim to improve the result from the previous section even further – either by finding better answers in the knowledge base of Austrian or by simply enhancing the output by e.g. quick replies that are fed from the long term memory. The latter is especially powerful since it drastically increases customer satisfaction and speed. In this module we work a lot with different IBM Watson APIs (which are extremely powerful, #fanboy). Here we also decide whether the content should be enhanced with a web view (e.g. a date picker in a web view) or not.DecideNow that we have finished the lifecycle, it is time to decide. This module now looks at the different answers that the previous modules produced and tries to decide what the best way to present the information in the messenger platform is. Is it a carousel?, An image? Just an emoji? Or is text just fine? What you see in your message window is the outcome of this decision.We failed – happens – how do we recover?As mentioned in the beginning, it was clear that the bot wouldn’t be able handle 100% of all use cases. So it was important to define an exit case that would hand over to the excellent support staff of Austrian Airlines. This in turn creates a few problems with the bot dynamic. Since the bot would automatically answer to every message, we had to “silence” it in these situations. This, and waking it up again, are some of the finer processes that are crucial to ensure a good customer experience overall. SUMMARYOverall, we were really happy with the results of this short 3-month innovation sprint with Austrian Airlines and are incredibly excited about what’s to come. We recognize that the bot performance we deliver at the moment is not yet were we want it to be – but that is how innovation and early prototyping works. We are constantly improving the setup and the confidence the system produces and are currently seeing more than 1.5k messages daily. Side Note: Vienna the City of ChatbotsOne amazing side note here: Vienna’s Bot Community. We are very proud to be located right at the center of bot activity in Europe. The City of Vienna was voted the most livable city in the world 8 consecutive times and now we are proud to say that we – as a community of bot developers, designers, writers and product owners – are the capital of bots in Europe too. Our monthly meetup is probably the biggest meetup in Europe and events like the ChatBotConf clearly establish our position. We (TheVentury) are excited to also launch Europe’s first chatbot centered accelerator in Vienna. We hope to further foster sustainable growth for this technology in Vienna, the City of Bots and are inviting everyone to apply to our first batch that starts Feb 2017. Bots regards,Jakob from TheVentury","October 27, 2016","https://theventury.com/wp-content/uploads/2017/11/plane-841441_1280-377x220.jpg"
"51","https://theventury.com/blog/online-real-estate-agents/","TheVentury","Why a Good Online Presence is Crucial for Today’s Real Estate Agents","Real Estate Agents need to get on board with connecting with clients online. There is no turning back the clock. Social media and search platforms are part of the world we live in and potential clients now expect to be able to find local agents online.Learn why a good online presence is vital to the success of local agents today.People Look OnlineThere is no way around it. People are looking online to find their answers. Whether they want to know about available homes in their area, down payment options or get an idea of the local agents in their area, people are using online search engines, Facebook groups and forums to get the information they need. Potential clients may look at popular real estate sites or use social media to get insights on a topic. Agents need to brand themselves and provide valuable information online in order to attract the segment of the population using mobile phones and tablets during their research process.Showcase ExpertiseOne reason to develop an online presence is to provide current and potential clients with information. It is not only about sharing the latest listings. Buyers, sellers and investors have a number of questions that an agent may help with to help them avoid a headache. Becoming an authority and sharing valuable resources and information can help an agent grow their following, develop stronger relationships and attract new clients. When information is valuable it is likely to be shared to a viewer’s circle, which in turn may increase an agent’s potential reach.Not only can agents provide information but previous clients and colleagues can offer referrals and feedback about an agent and their services. This can help viewers understand the type of experience they may be able to expect from an agent. Having this information available online can help an agent differentiate themselves from other local agents. The customer experience is key and word-of-mouth referrals and online reviews provide agents with a steady source of new clients.An Ever Changing WorldFacebook can be counted on to continually make changes. Search engines do too. Google algorithms are constantly updated to make it easier for those searching to find the information that they need. Therefore, agents need to stay aware and keep their website and pages user-friendly. This may mean removing old code and reworking a site to make it faster to upload on a mobile device.Content may need to be tweaked to format correctly on different types of platforms as each has its own optimal preferences. Long form content may be more suitable on a platform such as LinkedIn. Pinterest and Instagram are geared to sharing and commenting on images. Videos do well on Facebook. Agents would do well to perform a website audit and run through their website’s functionality on a regular basis to stay on top of any issues that may develop with the latest changes or through a hosting platform. In addition, continue to deliver a steady stream of content on social media platforms to maintain and grow engagement.Take Control of Your PresenceThe best way for agents to target and attract new clients is to develop a functional and professional website. A well-designed site works as a calling card and should have the following key features:Easy Navigation;Functionality across devices;An attractive and logical layout;Easy-to-read text; andHigh-quality images.Many agents choose to work with a professional web designer to create and maintain their site. The use of directories and social networking websites can help agents expand their network and attract both other professionals and potential clients. Continue to learn about developing an online presence and how to best make use out of a professional website and social media networks and never be at a loss for clients. Author:Kris Lindahl is a Real Estate Agent and expert based in Blaine. On his blog – www.krislindahl.com/blog – he gives deep insights about current Real Estate developments in the US and ideas how to improve Sales and Marketing for Realtors.","February 28, 2018","https://theventury.com/wp-content/uploads/2018/10/validation-valentin-aschermann-377x220.jpg"
"52","https://theventury.com/blog/outsider-perspective/","TheVentury","From An Intern’s Eyes: From the Valley to Vienna","This summer, I made the switch from working in the startup ecosystem of Silicon Valley to working with TheVentury as a student intern here in Vienna. As weeks go by, see what similar trends I’ve been able to find here: Silicon Valley to Vienna My name is Sean Moakley, I am a 20-year-old student at Santa Clara University, and I come from Eden Prairie, Minnesota. Like many university students, I don’t really know as much as I pretend to, but I can tell you one thing is certain: I want to work with entrepreneurs. Despite working with two (and onto my third) startups and living in Silicon Valley, I still can’t begin to understand what that really means.One thing has become crystal in my eyes, however: Founders are far more than enthusiastic programmers. They are some of the most amazing people you will ever meet.Endless hours of stress, ideas, breakthroughs, mistakes, and pitches. Mostly fueled by Philz coffee. You’d do anything for your startup, and you treat it like your child, because it is. According to Forbes, nine out of ten startups fail, and in a place like Silicon Valley, it’s as cutthroat as it gets. Founders dedicate their nights, their weekends, their very lives and souls to their work to even have a chance to be in that 10%. Why? Why push yourself to such limits when there’s virtually no chance you are starting “the next Uber of” your idea?Because everyone, like me, wants to be involved. From angels and VCs to naive students such as myself, we all want a piece, and we are all involved in the ecosystem. Working in Redwood City, CA last summer exposed me to more than a hundred startups all working out of one fully furnished ecosystem. Don’t imagine an Erlich Bachman-esque “I own 10% of that but you can stay here” situation; rather, we gave the space, the connections, the coaching, and sometimes the money that our companies needed to succeed. It was one nice big happy family.Once you left the building though, we had serious competitors. Every co-working space, incubator, and accelerator were constantly hunting for the brightest and best ideas and founders out there. And just like a team giving its tenth pitch to its tenth VC board, we all wanted an edge. Just being able to say that a Paypal or a Lyft or a Flexport worked out of your desk space, that you helped them reach where they are now, that you saw potential and invested before everyone else… it all creates an immense amount of pride and hype.This past summer, even as a lowly intern, I got to help these innovators I had come to admire. The time I spent among these entrepreneurs who spoke about their ideas like they would about a newborn child or their significant other, helped me realize the nearly unfathomable amount of passion and drive they have. Some of the most incredible people in Silicon Valley have names you’ve never heard before. And I was able to help connect startups with the mentors, investors, and corporate partners that they need to mold their idea into something great. It’s the ecosystem that developed stars of yesterday and today and is developing the stars of tomorrow–the picture of Silicon Valley.Yet it’s not just Silicon Valley, hallowed as it may be. People like this are all over the world.The end of the Summer came quickly, and soon enough I was on my way to Vienna, Austria for five months. World travel is another passion of mine; I’ve spent time volunteering in Central America, exploring in Italy, and studying in Australia, to name a few of my favorite experiences. While I’ll spend plenty of time traveling and exposing myself to new cultures, I want to be immersed in the startup culture here more than anything.And so I find myself interning here with TheVentury, eager to find that passion, desire, and drive in a new environment. A host of questions immediately come to my mind: What innovation is there to find in this cultural melting pot of a city, the most dense and diverse in an unbelievably stunning and mountainous country? What is all the rage in Vienna? Does Fintech, VR/AR, Sustainability, Chatbot, or AI receive the majority of funding? How profitable is a “successful” startup here? Exactly how much venture funding is there to be found in Vienna? I’ve got homework to do.Over the next few weeks I’ll gather every bit of information I can about the startup ecosystem here in Austria. As Vienna is truly in the center of Europe, it’ll be interesting to learn how it functions as a melting pot of ideas. While the entrepreneurial environment here is certainly far smaller than in Berlin or London, I can also guarantee that this charming “town” of almost 2 million people has more than just a rich history: It has the right aspirations to help create the next big thing.","November 28, 2017","https://theventury.com/wp-content/uploads/2018/01/chatbots-377x220.jpg"
"53","https://theventury.com/blog/pimptheoffice/","TheVentury","How we pimped our office in 24 hours","Do you sometimes sit at your desk and have moments of inspiration of possible ways to make your office cozier, friendlier and at the same time have a space that increases productivity?We did too and we decided to organize a FedEx day! Find out how exactly!FedEx Day at TheVenturyLast week we made it happen we changed our whole office with the help of a FedEx day and the manpower of the whole TheVentury team. FedEx stands for “Build and ship it in one day!” You have 24 hours to originate, develop, and deliver new products, new services, or a business process improvement. How? With a lot of energy, motivation, and pizza & beer.First step: The idea wallAs every innovative process is all about post it walls, every worker in the company, from intern to CEO, had the opportunity to come up with ideas and pin them. The great thing about these colourful walls is that you can easily cluster the ideas into different topics.What we wanted to change:rearrange tables the kitchen the meeting rooms the walls plants And of course, a sport and chill areaThe day we were all waiting forWe gathered around the office at 1:30 pm and started with taking a tour of inspiration. We went to have a look at the amazing mySugr office in the first district to get inspired. It was an awesome tour and experience. We then went back to the office where we were told how exactly we would pimp our office! Everyone had to choose one topic of interest which then formed a team. The result were mixed groups with people from different departments.After a short brainstorming session, the groups presented their ideas, received feedback and a budget of 500€. Luckily no one had the idea to spend it all on an ice cream machine (sorry guys, too late now).Let the fun begin!With a lot of enthusiasm and creative skills we pimped the office to match our companies core values. Which of course means the day ended with a night full of throwback music, free pizza and beers! Let us have a look at how we incorporated this initiative with our core values: EPIC!1. Entrepreneurial ThinkingEmbracing change is a key approach of TheVentury and this is why we decided to rearrange the space completely. Activity based working concept here we come! To make the offices more efficient, but also (and more importantly) inspiring, creative and innovative, we implemented our own version of David Dewane’s Eudaimonia Machine concept.We divided the space into different areas, allowing every employee to switch their work place setting according to his or her current needs. Some tasks are done better when you can work in a quiet corner, a creative brainstorming however would be more effective when done in a collaboration area and if someone needs to let off some steam, going to the “gym” and kicking the new punching bag might be the right call.2. PassionTo visualize how TheVentury drives innovation and progress we dedicated a wall to the team, showing a memory lane of events and achievements the company made over the last years. Another wall is devoted to our beloved clients with whom we share our enthusiasm and motivation. Now, they immediately see the purpose, intention and identity of TheVentury.3. ImpactWe love to create positive impact for the world but also for our team!Our workspace is like our home. We spend a significant amount of time of our lives in our office. This is why we had a whole team focusing only on plants. With the help of our new friends we are able to change the air quality in the office space. Did you know that plants have proved to alleviate stress? Taking care of the plants in between breaks can help you to deal with work-related stress. The presence of plants can reduce anxiety and even staring at plants can significantly reduce stress. As plants can uplift moods, employees are happier.4. Cooperation & EmpowermentLast but not least to visualize that our values are all about cooperation, we colored the hands of all the employees and let them form the letters E.P.I.C. on one of our office walls. One for all, all for one!To sum it up, our “pimp the office” idea worked out well because the employees were put in charge and were given full control over their areas. The team did not only meet the expectations but truly exceeded them. Sometimes, you just have to get your hands dirty, get started and trust that team work makes the dream work!If you want to know more about the “pimp the office” day and how the activity based working concept works, feel free to contact us at hello@theventury.com or simply come by for a cup of coffee! <U+0001F642>","August 14, 2019","https://theventury.com/wp-content/uploads/2020/03/blue-and-yellow-graph-on-stock-market-monitor-159888-377x250.jpg"
